<?xml version="1.0" encoding="UTF-8" standalone="no" ?>
<!DOCTYPE sala SYSTEM "mine_sala.dtd">
<sala version="1.2" autor="Mandos" area="poblado">
<id>poblado-prision01</id>
<nombre>Pasillo central</nombre>

<descripcion>
<item>Este lugar esta debilmente iluminado por antorchas colocadas a intervalos regulares en la pared. Se trata del inicio de un largo y sucio pasillo que se pierde hacia el este.</item>
<item>Unas escaleras suben en direccion norte hacia una habitacion con mas luz.</item>
</descripcion>

<salidas>
<arriba id="poblado-cuartel02">sala de entrada</arriba>
<este id="poblado-prision02">pasillo oscuro</este>
</salidas>

<propiedades volumen='20' luz='27' aura='40' combate="si"
ocultabilidad='20'/>

<objetos></objetos>
<encuentros>
</encuentros>
</sala>



