<?xml version="1.0" encoding="UTF-8" standalone="no" ?>
<!DOCTYPE saladeMine SYSTEM "mine_sala.dtd">
<sala version="1.2" autor="Hinuden" area="poblado-posada">

<id>poblado-reservado01</id>
<nombre>Reservado de la posada</nombre>

<descripcion>
	<item>El cuartito es pequeño y está separado del salón principal por una gruesa cortina. Las paredes son de madera. No está muy claro que tus palabras vayan a ser oidas sólo por tus acomapñantes. El tamaño del cuarto (5X3 metros) Deja el espacio justo para una mesa redonda y 8 sillas pequeñas. Hasta los hobbits se sentirían agobiados aqui.
	La iluminación del cuarto es bastante pobre. Apenas un candil de aceite en cada pared, lo que hace que el centro de la habitación esté en penumbra.</item>
</descripcion> 

<salidas>
	<sureste id="poblado-posada01">Salon principal</sureste>
</salidas>

<propiedades volumen='12' luz='40' aura='45' combate="si"
ocultabilidad='10'/>

<objetos>
</objetos>

<encuentros>
</encuentros>

</sala>
