<?xml version="1.0" encoding="UTF-8" standalone="no" ?>
<!DOCTYPE sala SYSTEM "mine_sala.dtd">
<sala version="1.2" autor="Hizgael" area="poblado">
<id>poblado-camino03</id>
<nombre>Bordeando la Empalizada</nombre>

<descripcion>
<item>Encuentras que la maleza es tan espesa que te impide el paso.</item>
</descripcion>

<salidas>
<este id="poblado-camino02">senda entre matorrales</este>
</salidas>

<propiedades volumen='40' luz='45' aura='45' combate="si"
ocultabilidad='60'/>

<objetos></objetos>
<encuentros>
</encuentros>
</sala>



